disease,Symptoms
reactive arthritis,"diarrhoea, fever, flu, gas, mouth ulcer, rash, redness, sometimes inflammation, swelling, tummy pain"
ready steady baby!,for pain
respiratory syncytial virus (rsv),"flu, pain"
rhabdomyosarcoma,"constipation, pain, swelling, tiredness"
rheumatoid arthritis,"energy swelling, fever, fitness inflammation, redness, tiredness, unpredictable pain"
ringworm and other fungal infections,"affected vomiting, blisters, diarrhoea, indigestion, off nausea, rash, redness"
rosacea,"aerobics inflammation, back pain, blisters, diarrhoea, dry mouth, edema, facial swelling, flu, headaches, indigestion, redness"
scabies,rash
scarlet fever,"appear vomiting, diarrhoea, headaches, measures nausea, rash, scarlet fever, severe pain, sore throat"
schizophrenia,"blurred vision, constipation, dry mouth, hip problems"
sciatica,"back pain, cases inflammation, flu, leg pain, sciatica, weakness"
self-harm,bruises
sepsis,"breathlessness, chest pain, diarrhoea, fever, flu, joint pain, loss of consciousness, muscle weakness, tired nausea, vomiting"
septic shock,"diarrhoea, flu, nausea, vomiting"
severe head injury,"headaches, like weakness, tiredness"
shingles,"fever, pain inflammation, rash, severe pain"
shortness of breath,"breathlessness, chest pain, flu"
sickle cell disease,"abdominal pain, blurred vision, breath weakness, chest pain, cough, dehydration, dizziness, fainting, fever, flu, headaches, high blood pressure, jaundice, seizures, shortness of breath, sudden swelling"
sinusitis,"allergies, bad breath, fever, halitosis, pain, toothache"
sjogren’s syndrome,"diarrhoea, dry mouth, fatigue, it nausea, joint pain, rash, swelling, tiredness, toilet vomiting, vasculitis inflammation"
skin cancer (melanoma),"eyes bleeding, fatigue, flu, melanoma nausea, tiredness, you pain"
skin light sensitivity (photosensitivity),"fatigue, flu, headaches, like pain, rash, redness, sunburn, urticaria"
skin rashes in children,"blisters, flu, rash, redness, scarlet fever, skin rashes in children, urticaria"
slapped cheek syndrome,"fainting, fever, joint pain, rash, shortness of breath, sore throat, tiredness, upset stomach"
soft tissue sarcomas,gas
soft tissue sarcomas: teenagers and young adults,"breathlessness, constipation, cough, pain, swelling, tiredness"
sore throat,sore throat
spina bifida,"bowel incontinence, constipation, diarrhoea, flu, muscle weakness, urinary incontinence"
spleen problems and spleen removal,"abdominal pain, andor fatigue, bleeding pain, cough, dizziness, easy bleeding, fever, rash, redness, sore throat, swelling"
stomach ache and abdominal pain,"abdominal pain, acid reflux, bleeding, constipation, flu, gas, gastritis inflammation, migraine, swelling"
stomach cancer,"cancer nausea, diarrhoea, fever, flu, indigestion, jaundice, pain vomiting, redness, stomach pain, swelling, tiredness"
stomach ulcer,"appetite fatigue, breathlessness, constipation, cramps bleeding, diarrhoea, dizziness, farting, gas, headaches, heartburn vomiting, indigestion, rash, tiredness, tummy pain"
streptococcus a (strep a),"gas, scarlet fever, sore throat"
stroke,"arm weakness, vessel bleeding"
subacromial pain syndrome,subacromial pain
sunburn,"dizziness, edema, fever, headaches, sunburn, swelling"
swollen glands,"cough, glandular fever, sore throat, swollen glands"
syphilis,"coordination fever, headaches, itchy skin, pain, rash, tiredness"
tennis elbow,pain
testicular cancer,"back pain, breast enlargement, breath nausea, breathlessness, bruises, cancer swelling, cancer vomiting, cough, diarrhoea, fatigue, mouth ulcer, shortness of breath, sunburn, tinnitus, tiredness"
testicular lumps and swellings,"flu, fluidfilled swelling, inflammation, severe pain"
thirst,"excessive bleeding, fatigue, flu, thirst, tiredness"
thrush,"rash, redness, vaginal discharge"
thyroid cancer,"as fatigue, diarrhoea, dry mouth, hormone pain, mouth ulcer, nausea, sore throat, tiredness, vomiting"
tick bites,"including inflammation, rash"
tinnitus,tinnitus
tonsillitis,"bad breath, cough, earache, earache pain, fever, inflammation, redness, sore throat, swelling"
toothache,dull pain
tourette’s syndrome,"cough, sore throat, stuttering"
transient ischaemic attack (tia),"dizziness, high blood pressure"
transverse myelitis,"mslike swelling, muscle weakness, myelitis pain"
trichomonas infection,pain
trigeminal neuralgia,"dizziness, facial pain, flu, gas, migraine, sinusitis inflammation, tiredness, urticaria, vomiting"
tuberculosis (tb),"blurred vision, cough, fatigue, fever, flu, itchy skin, jaundice, rash, seizures, swelling, swollen glands, tiredness, tummy pain"
type 1 diabetes,"blurred vision, dry mouth, feeling thirsty, feeling very thirsty, feeling very tired, flu, passing urine more often than usual, stomach pain, thirst, tiredness, vomiting, weeks nausea, weight loss and loss of muscle bulk"
type 2 diabetes,"blurred vision, cuts or wounds that heal slowly, feeling tired all the time, feeling very thirsty, feeling very tired, passing urine more often than usual, thirst, weight loss and loss of muscle bulk"
ulcerative colitis,"abdominal pain, diarrhoea, fever, gas, get inflammation, mouth ulcer, shortness of breath"
underactive thyroid,"abnormal swelling, constipation, drive bleeding, edema, else pain, flu, hearing loss, high blood pressure, hypothermia, tiredness, weakness"
urinary incontinence,"cough, urinary incontinence"
urinary incontinence in women,"cough, urinary incontinence"
urinary tract infection (uti),"fever, pain"
urinary tract infection (uti) in children,"jaundice, tiredness, upset stomach, vomiting unpleasantsmelling, weight pain"
vaginal cancer,"cancer bleeding, diarrhoea, pelvic pain, sunburn, tiredness, vaginal discharge"
vaginal discharge,"bleeding, by pain"
varicose eczema,"skin pain, swelling"
varicose veins,"any pain, blisters, flu, swelling"
venous leg ulcer,"diabetes swelling, fever, worsening pain"
vertigo,"dizziness, hearing loss, migraine, tinnitus, vertigo"
vitamin b12 or folate deficiency anaemia,"breathlessness, diarrhoea, fatigue, gas, headaches, inflammation, mouth ulcer, muscle weakness, tinnitus, tiredness"
vomiting in adults,"as vomiting, cholecystitis inflammation, diarrhoea, gas, severe pain, vomiting in adults"
vomiting in children and babies,"allergies, dehydration, flu, gas, itchy skin, painful swelling, projectile vomiting, rash, tummy pain, urticaria"
vulval cancer,"cancer bleeding, cancer pain, mouth ulcer, tiredness, vaginal discharge"
whooping cough,"cough, sore throat"
wilms’ tumour,"bleeding, diarrhoea, nausea, tiredness, vomiting"
wolff-parkinson-white syndrome,"chest pain, fainting, shortness of breath"
womb (uterus) cancer,"appetite fatigue, as pain, levels vomiting, spread nausea, tiredness, vaginal bleeding"
yellow fever,"muscle pain, treated nausea, vomiting, yellow fever"
zika virus,"back pain, joint pain, possible swelling, rash, rash fever"
